passageId,type,id,tag
"passage0","info","","睿宗玄真大聖大興孝皇帝諱旦，"
"passage0","info","","高宗第八子也。"
"passage0","info","","領冀州大都督、單于大都護。"
"passage3","info","","徙封豫王，"
"passage3","info","","又封冀王，"
"passage3","info","","累遷右金吾衛大將軍、洛州牧。"
"passage3","info","","徙封相王"
"passage3","info","","復封豫王。"
"passage3","info","","武后廢中宗，"
"passage3","info","","立為皇帝，"
"passage3","info","","以為皇嗣，"
"passage3","info","","居於東宮。"
"passage3","info","","中宗自房州還，"
"passage3","info","","復為皇太子，"
"passage3","info","","武后封皇嗣為相王，"
"passage3","info","","授太子右衛率。"
"passage3","info","","累遷右羽林衛大將軍、並州牧、安北大都護、諸道元帥。"
"passage3","info","","中宗復位，"
"passage3","info","","進號安國相王。"
"passage3","info","",""
"passage3","info","","韋皇后弒中宗"
"passage3","info","","矯詔立溫王重茂為皇太子。"
"passage3","info","","以刑部尚書裴談、工部尚書張錫同中書門下三品；"
"passage3","info","","吏部尚書張嘉福、中書侍郎岑羲、吏部侍郎崔湜同中書門下平章事。"
"passage3","info","","發諸府兵五萬屯京師，"
"passage3","info","","以韋溫總知內外兵馬。"
"passage14","info","","自立為皇太后。"
"passage14","info","","皇太子即皇帝位，"
"passage14","info","","以睿宗參謀政事，"
"passage14","info","","改元曰唐隆。"
"passage14","info","","太后臨朝攝政，"
"passage14","info","","罷睿宗參謀政事，"
"passage14","info","","以為太尉。"
"passage14","info","","封嗣雍王守禮為邠王，"
"passage14","info","","壽春郡王成器宋王。"
"passage14","info","","溫王妃陸氏為皇后。"
"passage14","info","","紀處訥、張嘉福、岑羲持節巡撫關內、河南北。"
"passage14","info","","臨淄郡王隆基率萬騎兵入北軍討亂，"
"passage14","info","","誅韋氏、安樂公主及韋巨源、馬秦客、附馬都尉武延秀、光祿少卿楊均。"
"passage14","info","","睿宗奉皇帝御安福門，"
"passage23","info","","進封隆基為平王。"
"passage23","info","","朝邑尉劉幽求為中書舍人，"
"passage23","info","","苑總監鐘紹京為中書侍郎，"
"passage23","info","","參知機務。"
"passage23","info","","紹京及黃門侍郎李日知同中書門下三品。"
"passage23","info","","紀處訥、韋溫、宗楚客、將作大匠宗晉卿、司農卿趙履溫伏誅。"
"passage23","info","","貶汴王邕為沁州刺史，"
"passage23","info","","蕭至忠許州刺史，"
"passage23","info","","韋嗣立宋州刺史，"
"passage23","info","","趙彥昭絳州刺史，"
"passage23","info","","崔湜華州刺史。"
"passage23","info","","平王隆基同中書門下三品，"
"passage23","info","","鐘紹京行中書令。"
"passage23","info","","張嘉福伏誅。"
"passage23","info","","安國相王即皇帝位於承天門，"
"passage23","info","","長流、長任及流人未達者還之。"
"passage34","info","","鐘紹京罷"
"passage35","info","","太常少卿薛稷為黃門侍郎，"
"passage36","info","","立平王隆基為皇太子。"
"passage36","info","","復則天大聖皇后號曰天後。"
"passage36","info","","許州刺史姚元之為兵部尚書、同中書門下三品。"
"passage36","info","","韋嗣立、蕭至忠為中書令，"
"passage36","info","","趙彥昭為中書侍郎，"
"passage36","info","","崔湜為吏部侍郎：同中書門下平章事。"
"passage36","info","","進封衡陽郡王成義為申王，"
"passage36","info","","巴陵郡王隆範岐王，"
"passage36","info","","彭城郡王隆業薛王。"
"passage36","info","","兵部尚書崔日用為黃門侍郎，"
"passage42","info","","洛州長史宋璟檢校吏部尚書、同中書門下三品。"
"passage42","info","","岑羲罷。"
"passage42","info","","貶蕭至忠為晉州刺史，"
"passage42","info","","韋嗣立許州刺史，"
"passage42","info","","趙彥昭宋州刺史，"
"passage42","info","","張錫絳州刺史。"
"passage42","info","","崔湜罷。"
"passage42","info","","貶李嶠為懷州刺史。"
"passage42","info","","姚元之兼中書令，"
"passage42","info","","蘇瑰為尚書左僕射。"
"passage42","info","","唐休璟、張仁亶罷。"
"passage42","info","","崔日用、薛稷罷。"
"passage42","info","","追廢皇后韋氏為庶人，"
"passage42","info","","安樂公主為勃逆庶人。"
"passage56","info","","貶裴談為蒲州刺史。"
"passage56","info","","太子少師致仕唐休璟為朔方道行軍大總管，"
"passage56","info","","以備突厥。"
"passage56","info","","追號天后曰大聖天後。"
"passage56","info","","出義宗於太廟。"
"passage56","info","","姚元之為中書令。"
"passage56","info","","葬孝和皇帝於定陵。"
"passage56","info","","蘇瑰、韋安石罷。"
"passage56","info","","宋王成器為尚書左僕射。"
"passage65","info","","宋王成器為司徒。"
"passage67","info","","太僕卿郭元振、中書侍郎張說同中書門下平章事。"
"passage67","info","","徙封重茂為襄王。"
"passage67","info","","追冊妃劉氏、竇氏為皇后。"
"passage67","info","","皇太子監國。"
"passage67","info","","貶姚元之為申州刺史，"
"passage67","info","","宋璟楚州刺史。"
"passage67","info","","太子少保韋安石為侍中。"
"passage67","info","","劉幽求罷。"
"passage77","info","","韋安石為中書令。"
"passage77","info","","宋王成器罷。"
"passage77","info","","李日知為侍中。"
"passage81","info","","作玄元皇帝廟。"
"passage83","info","","殿中監竇懷貞為左御史臺大夫、同中書門下平章事。"
"passage85","info","","皇太子釋奠於國學。"
"passage85","info","","韋安石為尚書左僕射、同中書門下三品。"
"passage85","info","","竇懷貞為侍中。"
"passage85","info","","吏部尚書劉幽求為侍中，"
"passage85","info","","右散騎常侍魏知古，"
"passage85","info","","太子詹事崔湜為中書侍郎：同中書門下三品；"
"passage85","info","","中書侍郎陸象先同中書門下平章事。"
"passage85","info","","韋安石、李日知、郭元振、竇懷貞、張說罷。"
"passage92","info","","享於太廟"
"passage98","info","","幸安福門，"
"passage100","info","","陸象先同中書門下三品。"
"passage100","info","","戶部尚書岑羲、左御史臺大夫竇懷貞同中書門下三品。"
"passage100","info","","皇太子釋奠於國學。"
"passage104","info","","有事於北郊"
"passage105","info","","改元曰延和。"
"passage107","info","","岑羲為侍中。"
"passage107","info","","追號大聖天後為天后聖帝。"
"passage107","info","","刑部尚書郭元振為朔方道行軍大總管，"
"passage107","info","","以伐突厥。"
"passage107","info","","幽州都督孫佺、左武衛將軍李楷洛、左威衛將軍周以悌及奚戰於冷陘山，"
"passage112","info","","兵部尚書李迥秀為朔方道後軍大總管。"
"passage112","info","","竇懷貞為尚書右僕射、平章軍國重事。"
"passage112","info","","幸安福門觀樂，"
"passage116","info","","立皇太子為皇帝，"
"passage116","info","","自尊為太上皇，"
"passage117","info","","追號天后聖帝為聖後。"
"passage117","info","","賜內外官及五品以上子為父後者勛、爵，"
"passage119","info","","立皇太子妃王氏為皇后。"
"passage119","info","","封皇帝子嗣直為剡王，"
"passage119","info","","嗣謙郢王。"
"passage119","info","","宋王成器為司徒。"
"passage119","info","","竇懷貞為尚書左僕射，"
"passage119","info","","劉幽求守尚書右僕射：同中書門下三品；"
"passage119","info","","魏知古為侍中，"
"passage119","info","","崔湜檢校中書令。"
"passage119","info","","流劉幽求於封州。"
"passage125","info","","封皇帝子嗣升為陜王。"
"passage127","info","","幽州都督宋璟為左軍大總管，"
"passage127","info","","並州長史薛訥為中軍大總管，"
"passage127","info","","兵部尚書郭元振為右軍大總管。"
"passage130","info","","吏部尚書蕭至忠為中書令。"
"passage133","info","","丙辰，"
"passage133","info","","郭元振同中書門下三品。"
"passage135","info","","誥歸政於皇帝。"
"passage135","info","",""
"passage135","info","","崩於百福殿"
"passage135","info","","年五十五，"
"passage135","info","","謚曰大聖真皇帝。"
"passage135","info","","天寶十三載，"
"passage135","info","","增謚玄真大聖大興孝皇帝。"